{
  "contracts": [
    {
      "authority_ref": "finance-policy@1.0.0",
      "bundle_hash": "sha256:7c2ec612a5a58f806a89ad245a63dbecda969bdaf4d06b4d2c04beaab0e229b7",
      "bundle_path": "contracts/finance-policy-1.0.0.authority-bundle.json",
      "compilation_report_hash": "sha256:5ffb7ae6eea3a350f61ed5fcf52c357fb073446d6e13df9d935a04c1c47bd117",
      "contract_hash": "sha256:c26887c13491fb5db61f46e3cc83a5769fd4071087e978e9de8db2e5ab20248a",
      "contract_id": "finance-policy",
      "contract_ref": "finance-policy@1.0.0",
      "contract_version": "1.0.0",
      "lifecycle_state": "active",
      "path": "contracts/finance-policy-1.0.0.contract.json",
      "publication_id": "pub_20260717_0001",
      "published_at": "2026-07-17T16:00:00+00:00",
      "published_by": "waveframe-governance",
      "source_hash": "sha256:cb6740ea72ac0687d6642e19058e33ecba203424c5084765cf0cea78e41d48c0"
    }
  ],
  "generated_at": "2026-07-17T16:00:00+00:00",
  "latest": {
    "finance-policy": {
      "authority_ref": "finance-policy@1.0.0",
      "bundle_hash": "sha256:7c2ec612a5a58f806a89ad245a63dbecda969bdaf4d06b4d2c04beaab0e229b7",
      "bundle_path": "contracts/finance-policy-1.0.0.authority-bundle.json",
      "compilation_report_hash": "sha256:5ffb7ae6eea3a350f61ed5fcf52c357fb073446d6e13df9d935a04c1c47bd117",
      "contract_hash": "sha256:c26887c13491fb5db61f46e3cc83a5769fd4071087e978e9de8db2e5ab20248a",
      "contract_id": "finance-policy",
      "contract_ref": "finance-policy@1.0.0",
      "contract_version": "1.0.0",
      "lifecycle_state": "active",
      "path": "contracts/finance-policy-1.0.0.contract.json",
      "publication_id": "pub_20260717_0001",
      "published_at": "2026-07-17T16:00:00+00:00",
      "published_by": "waveframe-governance",
      "source_hash": "sha256:cb6740ea72ac0687d6642e19058e33ecba203424c5084765cf0cea78e41d48c0"
    }
  },
  "registry_hash": "sha256:794dba5cf275a0cb52fb73cdfbdcdd0adb0b6896f8ea10017368969736a53c12",
  "schema_version": "contract_registry.v1"
}
